id,brand,colorway,estimatedMarketValue,gender,image,links,name,releaseDate,releaseYear,retailPrice,silhouette,sku,story
5338a798-ac8b-442f-a8b2-71d3a79311a5,Jordan,White/Black/Dark Mocha,120,youth,"{'360': [], 'original': '', 'small': '', 'thumbnail': ''}","{'stockX': '', 'goat': 'https://goat.com/sneakers/air-jordan-1-retro-low-og-gs-mocha-cz0858-102', 'flightClub': 'https://flightclub.com/air-jordan-1-retro-low-og-gs-mocha-cz0858-102', 'stadiumGoods': ''}",Air Jordan 1 Retro Low OG GS 'Mocha',2024-08-21,2024,120,Air Jordan 1,CZ0858-102,"The Air Jordan 1 Retro Low OG GS ‘Mocha’ showcases color blocking that recalls the ‘Dark Mocha’ AJ1 from 2020. The low-top sports a white leather upper with contrasting black accents on the Swoosh and forefoot overlay. Brown nubuck construction is utilized on the heel and back tab, marked with the iconic Wings logo. A woven Nike tag adorns the breathable nylon tongue. The sneaker rests on a standard rubber cupsole, featuring stitched sidewall construction and encapsulated Air-sole cushioning."
9266875a-4e96-4e80-b968-e8d54d62cba4,Jordan,White/Black/Dark Mocha,75,youth,"{'360': [], 'original': '', 'small': '', 'thumbnail': ''}","{'stockX': '', 'goat': 'https://goat.com/sneakers/air-jordan-1-retro-low-og-ps-mocha-fq5436-102', 'flightClub': 'https://flightclub.com/air-jordan-1-retro-low-og-ps-mocha-fq5436-102', 'stadiumGoods': ''}",Air Jordan 1 Retro Low OG PS 'Mocha',2024-08-21,2024,75,Air Jordan 1,FQ5436-102,"The Air Jordan 1 Retro Low OG PS ‘Mocha’ features a white and black leather upper with brown nubuck construction on the heel overlay and back tab. The latter displays the iconic Wings logo, while a woven Nike tag decorates the tongue. The low-top is appointed with classic Jordan details, including a perforated toe box and a durable rubber cupsole. Underfoot, the outsole pattern features a pivot circle originally designed for the hardwood."
bfee372b-8078-44ee-b878-51bdbc622b06,Jordan,White/Black/Dark Mocha,65,infant,"{'360': [], 'original': '', 'small': '', 'thumbnail': ''}","{'stockX': '', 'goat': 'https://goat.com/sneakers/air-jordan-1-retro-low-og-td-mocha-fq5435-102', 'flightClub': 'https://flightclub.com/air-jordan-1-retro-low-og-td-mocha-fq5435-102', 'stadiumGoods': ''}",Air Jordan 1 Retro Low OG TD 'Mocha',2024-08-21,2024,65,Air Jordan 1,FQ5435-102,"The Air Jordan 1 Retro Low OG TD ‘Mocha’ features color blocking that parallels the AJ1 ‘Dark Mocha’ from 2020. The low-top makes use of a white leather upper, contrasted by black accents on the forefoot overlay and signature Swoosh. Brown nubuck construction is utilized on the heel overlay and back tab. The latter is stamped with the iconic Wings logo, while a woven Nike tag appears on the tongue. Underfoot, a black rubber outsole provides reliable traction for growing feet."
5f233519-992e-45c3-b7f3-9f20ec6c448a,Jordan,Black/Solar Flare-Total Crimson Abyss,250,men,"{'360': [], 'original': '', 'small': '', 'thumbnail': ''}","{'stockX': 'https://stockx.com/air-jordan-3-retro-j-balvin-rio', 'goat': 'https://goat.com/sneakers/j-balvin-x-air-jordan-3-retro-rio-fn0344-001', 'flightClub': 'https://flightclub.com/j-balvin-x-air-jordan-3-retro-rio-fn0344-001', 'stadiumGoods': ''}",Jordan 3 Retro J Balvin Rio,2024-07-01,2024,250,Air Jordan 3,FN0344-001,
8412535a-3029-470a-aa42-f79c71637d54,Jordan,Canary/Racer Blue-Light Silver-Gum Medium Brown,1850,women,"{'360': [], 'original': 'https://image.goat.com/attachments/product_template_pictures/images/097/103/468/original/DZ4137_700.png.png', 'small': 'https://image.goat.com/750/attachments/product_template_pictures/images/097/103/468/original/DZ4137_700.png.png', 'thumbnail': 'https://image.goat.com/375/attachments/product_template_pictures/images/097/103/468/original/DZ4137_700.png.png'}","{'stockX': 'https://stockx.com/air-jordan-1-retro-low-og-sp-travis-scott-canary-womens', 'goat': 'https://goat.com/sneakers/travis-scott-x-wmns-air-jordan-1-retro-low-og-sp-canary-dz4137-700', 'flightClub': 'https://flightclub.com/travis-scott-x-wmns-air-jordan-1-retro-low-og-sp-canary-dz4137-700', 'stadiumGoods': ''}",Jordan 1 Retro Low OG SP Travis Scott Canary (Women's),2024-07-01,2024,150,Air Jordan 1,DZ4137-700,
c8f2762d-9bef-4bbd-8f08-d97bceca8c3b,Jordan,Summit White/Obsidian-Summit White-Gum Medium Brown,180,men,"{'360': [], 'original': '', 'small': '', 'thumbnail': ''}","{'stockX': 'https://stockx.com/air-jordan-1-retro-high-og-denim', 'goat': 'https://goat.com/sneakers/air-jordan-1-retro-high-og-summit-white-obsidian-fq2947-100', 'flightClub': 'https://flightclub.com/air-jordan-1-retro-high-og-summit-white-obsidian-fq2947-100', 'stadiumGoods': ''}",Jordan 1 Retro High OG Denim,2024-07-01,2024,180,Air Jordan 1,FQ2947-100,
4280d52c-99fe-4a7a-a5f6-418c92393023,Jordan,White/Black,160,youth,"{'360': [], 'original': '', 'small': '', 'thumbnail': ''}","{'stockX': '', 'goat': 'https://goat.com/sneakers/air-jordan-6-retro-gs-reverse-oreo-384665-112', 'flightClub': 'https://flightclub.com/air-jordan-6-retro-gs-reverse-oreo-384665-112', 'stadiumGoods': ''}",Air Jordan 6 Retro GS 'Reverse Oreo',2024-06-08,2024,160,Air Jordan 6,384665-112,"Made for big kids, the Air Jordan 6 Retro GS ‘Reverse Oreo’ draws inspiration from the black-and-white AJ6 colorway from 2010. The legacy silhouette dons a white leather upper, contrasted by a molded black tongue and a matching black textile lining. Jumpman branding embellishes the neoprene lace cover and back heel. The midsole and molded pull tab feature white speckles against a solid black backdrop, accentuating the shoe’s cookies-and-cream design motif Underfoot, a translucent rubber outsole provides grippy traction."
4a47c221-a61d-4217-8b3b-05a93a76d3c0,Jordan,White/Black,100,youth,"{'360': [], 'original': '', 'small': '', 'thumbnail': ''}","{'stockX': '', 'goat': 'https://goat.com/sneakers/air-jordan-6-retro-ps-reverse-oreo-dv3605-112', 'flightClub': 'https://flightclub.com/air-jordan-6-retro-ps-reverse-oreo-dv3605-112', 'stadiumGoods': ''}",Air Jordan 6 Retro PS 'Reverse Oreo',2024-06-08,2024,100,Air Jordan 6,DV3605-112,"Offered in pre-school sizing, the Air Jordan 6 Retro PS ‘Reverse Oreo’ presents a two-tone colorway inspired by the classic AJ6 release from 2010. Built with crisp white leather, the upper features perforated detailing and contrasting hits of black on the molded tongue and interior lining. Embroidered Jumpman branding decorates the lace cover and back heel. Anchoring the sneaker is a lightweight foam midsole, ornamented with black accents covered in white speckles."
bb9f7af6-ce7c-4047-b127-5d5339c8f41f,Jordan,White/Black,85,infant,"{'360': [], 'original': '', 'small': '', 'thumbnail': ''}","{'stockX': '', 'goat': 'https://goat.com/sneakers/air-jordan-6-retro-td-reverse-oreo-dv3606-112', 'flightClub': 'https://flightclub.com/air-jordan-6-retro-td-reverse-oreo-dv3606-112', 'stadiumGoods': ''}",Air Jordan 6 Retro TD 'Reverse Oreo',2024-06-08,2024,85,Air Jordan 6,DV3606-112,"The Air Jordan 6 Retro TD ‘Reverse Oreo’ takes its design cues from a black-and-white AJ6 colorway originally released in 2010. Crisp white leather is utilized on the upper, accented with perforated detailing and contrasting hits of black on the interior lining and tongue. The latter is marked with Jordan branding and an embroidered Jumpman logo. A second Jumpman icon decorates the back heel. A cushy foam midsole features white speckles against a solid black backdrop."
2315421d-c14c-4558-b873-f9b9dbe40ab7,Jordan,White/Legend Pink,80,youth,"{'360': [], 'original': '', 'small': '', 'thumbnail': ''}","{'stockX': '', 'goat': 'https://goat.com/sneakers/air-jordan-11-retro-low-gs-legend-pink-580522-160', 'flightClub': 'https://flightclub.com/air-jordan-11-retro-low-gs-legend-pink-580522-160', 'stadiumGoods': ''}",Air Jordan 11 Retro Low GS 'Legend Pink',2024-06-01,2024,80,Air Jordan 11,580522-160,"Made for big kids, the Air Jordan 11 Retro Low GS ‘Legend Pink’ delivers a pastel colorway of the legacy silhouette. White ballistic mesh is utilized on the upper, fortified with a pink patent leather mudguard and secured with rope laces that feed through webbing eyelets. Branding elements include a Jumpman logo and a stylized ‘23’ on the back heel. The low-top is mounted on a white Phylon midsole with encapsulated Air-sole cushioning and a carbon fiber spring plate. A translucent rubber outsole features herringbone traction pods for reliable grip."
d1372fbf-77a6-47c0-a0c3-f98e63e8eded,Jordan,White/Legend Pink,60,infant,"{'360': [], 'original': '', 'small': '', 'thumbnail': ''}","{'stockX': '', 'goat': 'https://goat.com/sneakers/air-jordan-11-retro-low-td-legend-pink-645107-160', 'flightClub': 'https://flightclub.com/air-jordan-11-retro-low-td-legend-pink-645107-160', 'stadiumGoods': ''}",Air Jordan 11 Retro Low TD 'Legend Pink',2024-06-01,2024,60,Air Jordan 11,645107-160,"The Air Jordan 11 Retro Low TD ‘Legend Pink’ brings pastel accents to the championship model. Rope laces feed through webbing eyelets to secure the upper, crafted from white ballistic mesh with a shiny patent leather mudguard in a soft pink finish. Jumpman branding decorates the tongue and back tab. The sneaker rests on a white foam midsole for lightweight cushioning and a comfortable ride. A translucent rubber outsole provides durable traction."
8a975f9b-efed-4656-ad61-9463592e959a,Jordan,Black/Legend Medium Brown/White/Sail,180,women,"{'360': [], 'original': '', 'small': '', 'thumbnail': ''}","{'stockX': '', 'goat': 'https://goat.com/sneakers/wmns-air-jordan-1-retro-high-og-legend-medium-brown-fd2596-021', 'flightClub': 'https://flightclub.com/wmns-air-jordan-1-retro-high-og-legend-medium-brown-fd2596-021', 'stadiumGoods': ''}",Wmns Air Jordan 1 Retro High OG 'Latte',2024-05-29,2024,180,Air Jordan 1,FD2596-021,"The Women’s Air Jordan 1 Retro High OG ‘Latte’ dresses the classic silhouette in color blocking that mirrors the ‘Dark Mocha’ AJ1 from 2020. Built with a crisp white base, the leather upper features black accents on the forefoot overlay and Swoosh, along with contrasting hits of dark tan on the heel and collar flap. The latter is marked with the iconic Wings logo, while a woven Nike Air tag embellishes the tongue. Underpinning the high-top is a vintage off-white rubber midsole, fitted with an Air-sole heel unit encapsulated in a lightweight polyurethane wedge."
eb9e3be0-be37-4e77-b0b9-ce7e095aff40,Jordan,White/Oxidized Green/White/Neutral Grey,210,men,"{'360': [], 'original': '', 'small': '', 'thumbnail': ''}","{'stockX': '', 'goat': 'https://goat.com/sneakers/air-jordan-4-retro-oxidized-green-fq8138-103', 'flightClub': 'https://flightclub.com/air-jordan-4-retro-oxidized-green-fq8138-103', 'stadiumGoods': ''}",Air Jordan 4 Retro 'Oxidized Green',2024-05-25,2024,210,Air Jordan 4,FQ8138-103,"The Air Jordan 4 Retro ‘Oxidized Green’ arrives in a crisp white leather upper with tonal quarter panel netting and grey molded eyelets. Contrasting green accents make their way to the support wings and back tab, marked with embossed Jumpman branding. A second Jumpman logo decorates the woven tongue tag. An additional hit of green coloring distinguishes the lightweight polyurethane midsole, featuring an exposed Air-sole unit in the heel."
8d128576-87cc-4c2e-a8a1-61bf8b6de120,Jordan,White/Gym Red/Black,100,youth,"{'360': [], 'original': '', 'small': '', 'thumbnail': ''}","{'stockX': '', 'goat': 'https://goat.com/sneakers/air-jordan-12-retro-ps-red-taxi-151186-162', 'flightClub': 'https://flightclub.com/air-jordan-12-retro-ps-red-taxi-151186-162', 'stadiumGoods': ''}",Air Jordan 12 Retro PS 'Red Taxi',2024-05-18,2024,100,Air Jordan 12,151186-162,"Built for little kids, the Air Jordan 12 Retro PS ‘Red Taxi’ adds bold pops of color to an OG-inspired white and black colorway. White tumbled leather is utilized on the upper, which is accented with radiating stitched lines and a black lizard-textured mudguard. An embroidered Jumpman logo in Gym Red adorns the tongue, matching the TPU midfoot overlay. A foam midsole offers lightweight cushioning with each step, while the rubber outsole features herringbone traction pods for superior grip."
a211e6a9-78ec-4b62-ac6e-e6d6d29b586c,Jordan,White/Gym Red/Black,0,men,"{'360': [], 'original': '', 'small': '', 'thumbnail': ''}","{'stockX': '', 'goat': 'https://goat.com/sneakers/air-jordan-12-retro-red-taxi-ct8013-162', 'flightClub': 'https://flightclub.com/air-jordan-12-retro-red-taxi-ct8013-162', 'stadiumGoods': ''}",Air Jordan 12 Retro 'Red Taxi',2024-05-18,2024,0,Air Jordan 12,CT8013-162,"The Air Jordan 12 Retro ‘Red Taxi’ adds splashes of color to a familiar colorway inspired by an OG 1996 release. Crafted from tumbled white leather, the upper features radiating stitched lines and a lizard-textured mudguard in a contrasting black finish. A crimson Jumpman logo is embroidered on the tongue, matching a midfoot TPU overlay. Performance benefits include a lightweight Phylon midsole with full-length Zoom Air cushioning and a carbon fiber spring plate."
e76fab85-6adb-4384-b75a-4151ab1e56e5,Jordan,White/Gym Red/Black,85,infant,"{'360': [], 'original': '', 'small': '', 'thumbnail': ''}","{'stockX': '', 'goat': 'https://goat.com/sneakers/air-jordan-12-retro-td-red-taxi-850000-162', 'flightClub': 'https://flightclub.com/air-jordan-12-retro-td-red-taxi-850000-162', 'stadiumGoods': ''}",Air Jordan 12 Retro TD 'Red Taxi',2024-05-18,2024,85,Air Jordan 12,850000-162,"The Air Jordan TD Retro PS ‘Red Taxi’ draws inspiration from an OG colorway of the championship silhouette that Michael Jordan wore during the ’96 – ’97 NBA season. Like the older shoe, the design is highlighted by a white tumbled leather upper, accented with stitched lines and fortified with a black lizard-textured mudguard. Gym Red accents make their way to the midfoot overlay and a Jumpman logo embroidered on the tongue. Underfoot, the outsole features herringbone traction pods for reliable grip."
f1a835ba-a50f-4deb-a27c-484fc4f14975,Jordan,White/Gym Red/Black,160,youth,"{'360': [], 'original': '', 'small': '', 'thumbnail': ''}","{'stockX': '', 'goat': 'https://goat.com/sneakers/air-jordan-12-retro-gs-red-taxi-153265-162', 'flightClub': 'https://flightclub.com/air-jordan-12-retro-gs-red-taxi-153265-162', 'stadiumGoods': ''}",Air Jordan 12 Retro GS 'Red Taxi',2024-05-18,2024,160,Air Jordan 12,153265-162,"Made for big kids, the Air Jordan 12 Retro GS ‘Red Taxi’ takes inspiration from a classic OG colorway of the championship silhouette. Radiating stitched lines enliven the upper, crafted from white tumbled leather with a black lizard-textured mudguard. Gym Red accents settle on the midfoot overlay and an embroidered Jumpman logo atop the tongue. A lightweight Phylon midsole with Zoom Air cushioning provides a smooth and responsive ride."
2b8c9b95-a411-489f-947a-01b4405a0e09,Jordan,Black/Varsity Royal/White,60,infant,"{'360': [], 'original': '', 'small': '', 'thumbnail': ''}","{'stockX': '', 'goat': 'https://goat.com/sneakers/air-jordan-11-retro-low-td-space-jam-fv5120-004', 'flightClub': 'https://flightclub.com/air-jordan-11-retro-low-td-space-jam-fv5120-004', 'stadiumGoods': ''}",Air Jordan 11 Retro Low TD 'Space Jam',2024-05-11,2024,60,Air Jordan 11,FV5120-004,"The Air Jordan 11 Retro Low TD ‘Space Jam’ takes inspiration from the sleek AJ11 of the same name, which debuted in movie theaters in 1996 before hitting store shelves in 2000. The upper is built with black ballistic mesh and fortified with a tonal patent leather mudguard. Jumpman branding decorates the tongue and back heel. A crisp white finish is applied to a cushy foam midsole. Underfoot, a translucent rubber outsole yields durable traction."
7733e57a-8c68-4521-8214-64f77cb2d78a,Jordan,Black/Varsity Royal/White,190,men,"{'360': [], 'original': '', 'small': '', 'thumbnail': ''}","{'stockX': '', 'goat': 'https://goat.com/sneakers/air-jordan-11-retro-low-space-jam-fv5104-004', 'flightClub': 'https://flightclub.com/air-jordan-11-retro-low-space-jam-fv5104-004', 'stadiumGoods': ''}",Air Jordan 11 Retro Low 'Space Jam',2024-05-11,2024,190,Air Jordan 11,FV5104-004,"The Air Jordan 11 Retro Low ‘Space Jam’ is based on the high-top AJ11 of the same name, featuring a black ballistic mesh upper with a tonal patent leather mudguard. Rope laces feed through webbing eyelets for a secure fit, while the back heel is marked with a stylized ‘23’ and classic Jumpman branding. Anchoring the sneaker is a white Phylon midsole, fitted with full-length Air-sole cushioning and an exposed carbon fiber plate. A translucent rubber outsole utilizes herringbone traction pods for superior grip."
87643047-eb8f-4992-bbf1-3fc6c88abaf5,Jordan,Black/Varsity Royal/White,150,youth,"{'360': [], 'original': '', 'small': '', 'thumbnail': ''}","{'stockX': '', 'goat': 'https://goat.com/sneakers/air-jordan-11-retro-low-gs-space-jam-fv5121-004', 'flightClub': 'https://flightclub.com/air-jordan-11-retro-low-gs-space-jam-fv5121-004', 'stadiumGoods': ''}",Air Jordan 11 Retro Low GS 'Space Jam',2024-05-11,2024,150,Air Jordan 11,FV5121-004,"Built for big kids, the Air Jordan 11 Retro Low GS ‘Space Jam’ takes inspiration from the coveted AJ11 release from 2000. Rope laces feed through webbing eyelets to secure an upper crafted from black ballistic mesh with a tonal patent leather mudguard. ‘23’ is printed on the heel tab, directly above an embroidered Jumpman logo in Varsity Royal. The low-top is mounted on a white Phylon midsole, enhanced with encapsulated Air-sole cushioning and supported by a translucent rubber outsole."
8e205b90-120a-4fb2-b69d-39375de00f83,Jordan,Black/Varsity Royal/White,80,youth,"{'360': [], 'original': '', 'small': '', 'thumbnail': ''}","{'stockX': '', 'goat': 'https://goat.com/sneakers/air-jordan-11-retro-low-ps-space-jam-fv5116-004', 'flightClub': 'https://flightclub.com/air-jordan-11-retro-low-ps-space-jam-fv5116-004', 'stadiumGoods': ''}",Air Jordan 11 Retro Low PS 'Space Jam',2024-05-11,2024,80,Air Jordan 11,FV5116-004,"Made for little kids, the Air Jordan 11 Retro Low PS ‘Space Jam’ showcases the same sleek design worn by Michael Jordan in his 1996 cinematic debut. A stealthy black finish is executed on the upper, built with ballistic mesh and a shiny patent leather mudguard. Embroidered on the back heel is a royal blue Jumpman logo for a discreet pop of color. A white foam midsole offers lightweight cushioning with each step, while a translucent rubber outsole provides grippy traction."
224a7f8d-13e4-417d-a0bf-b4a627f5e8db,Jordan,White/Cosmic Clay/Sail/Cement Grey/Anthracite,85,infant,"{'360': [], 'original': 'https://image.goat.com/attachments/product_template_pictures/images/096/964/539/original/FQ9175_121.png.png', 'small': 'https://image.goat.com/750/attachments/product_template_pictures/images/096/964/539/original/FQ9175_121.png.png', 'thumbnail': 'https://image.goat.com/375/attachments/product_template_pictures/images/096/964/539/original/FQ9175_121.png.png'}","{'stockX': '', 'goat': 'https://goat.com/sneakers/air-jordan-3-retro-td-cosmic-clay-fq9175-121', 'flightClub': 'https://flightclub.com/air-jordan-3-retro-td-cosmic-clay-fq9175-121', 'stadiumGoods': ''}",Air Jordan 3 Retro TD 'Georgia Peach',2024-05-04,2024,85,Air Jordan 3,FQ9175-121,
297b0b8c-65ca-45ce-b70a-8ba652f88eb7,Jordan,White/Cosmic Clay/Sail/Cement Grey/Anthracite,100,youth,"{'360': [], 'original': '', 'small': '', 'thumbnail': ''}","{'stockX': '', 'goat': 'https://goat.com/sneakers/air-jordan-3-retro-ps-cosmic-clay-fq9174-121', 'flightClub': 'https://flightclub.com/air-jordan-3-retro-ps-cosmic-clay-fq9174-121', 'stadiumGoods': ''}",Air Jordan 3 Retro PS 'Georgia Peach',2024-05-04,2024,100,Air Jordan 3,FQ9174-121,
3c9af525-4527-4f51-ba1c-d0ec28797b2e,Jordan,White/Cosmic Clay/Sail/Cement Grey/Anthracite,200,women,"{'360': [], 'original': '', 'small': '', 'thumbnail': ''}","{'stockX': '', 'goat': 'https://goat.com/sneakers/wmns-air-jordan-3-retro-cosmic-clay-ck9246-121', 'flightClub': 'https://flightclub.com/wmns-air-jordan-3-retro-cosmic-clay-ck9246-121', 'stadiumGoods': ''}",Wmns Air Jordan 3 Retro 'Georgia Peach',2024-05-04,2024,200,Air Jordan 3,CK9246-121,
4a42c391-4907-4f36-9431-699ecc2be36a,Jordan,White/Black-Green Glow,180,men,"{'360': [], 'original': '', 'small': '', 'thumbnail': ''}","{'stockX': 'https://stockx.com/air-jordan-1-retro-high-og-green-glow', 'goat': 'https://goat.com/sneakers/air-jordan-1-retro-high-og-green-glow-dz5485-130', 'flightClub': 'https://flightclub.com/air-jordan-1-retro-high-og-green-glow-dz5485-130', 'stadiumGoods': ''}",Jordan 1 Retro High OG Green Glow,2024-05-04,2024,180,Air Jordan 1,DZ5485-130,
0b9b4a08-0798-483e-8826-a71ea81be0cb,Jordan,Off White/Military Blue/Neutral Grey,85,infant,"{'360': [], 'original': '', 'small': '', 'thumbnail': ''}","{'stockX': '', 'goat': 'https://goat.com/sneakers/air-jordan-4-retro-td-military-blue-2024-bq7670-141', 'flightClub': 'https://flightclub.com/air-jordan-4-retro-td-military-blue-2024-bq7670-141', 'stadiumGoods': ''}",Air Jordan 4 Retro TD 'Military Blue' 2024,2024-04-27,2024,85,Air Jordan 4,BQ7670-141,"The 2024 edition of the Air Jordan 4 Retro TD ‘Military Blue’ brings back an OG colorway in time for the classic silhouette’s 35th anniversary. True to the original, the upper features off-white leather construction with quarter panel netting and TPU support wings. Military Blue lands on the upper and lower eyelets, along with a heel tab marked with Nike Air branding. Lightweight cushioning is provided by a two-tone foam midsole, reinforced underfoot by a herringbone-traction outsole."
190aeb0e-94a3-44a4-acaf-1b8972e8ff5f,Jordan,Off-White/Military Blue/Neutral Grey,600,men,"{'360': [], 'original': '', 'small': '', 'thumbnail': ''}","{'stockX': '', 'goat': 'https://goat.com/sneakers/air-jordan-4-retro-military-blue-2024-fv5029-141', 'flightClub': 'https://flightclub.com/air-jordan-4-retro-military-blue-2024-fv5029-141', 'stadiumGoods': ''}",Air Jordan 4 Retro 'Military Blue' 2024,2024-04-27,2024,215,Air Jordan 4,FV5029-141,"The 2024 edition of the Air Jordan 4 Retro ‘Military Blue’ brings back a coveted OG colorway of the legacy silhouette. Smooth off-white leather is utilized on the upper, featuring quarter panel netting and a tonal nubuck forefoot overlay. A vibrant blue Jumpman logo adorns the woven tongue tag, matching the molded eyelets and a back tab marked with Nike Air branding. The sneaker rides on a lightweight polyurethane midsole with encapsulated Air-sole cushioning in the forefoot and a visible Air bag in the heel."
3e11d933-d463-4cec-b7a2-3672a4623682,Jordan,Off White/Military Blue/Neutral Grey,160,youth,"{'360': [], 'original': '', 'small': '', 'thumbnail': ''}","{'stockX': '', 'goat': 'https://goat.com/sneakers/air-jordan-4-retro-gs-military-blue-2024-hf4281-141', 'flightClub': 'https://flightclub.com/air-jordan-4-retro-gs-military-blue-2024-hf4281-141', 'stadiumGoods': ''}",Air Jordan 4 Retro GS 'Military Blue' 2024,2024-04-27,2024,160,Air Jordan 4,HF4281-141,"Made for big kids, the 2024 reissue of the Air Jordan 4 Retro GS ‘Military Blue’ brings back one of the four OG colorways of the classic silhouette. The off-white leather upper is equipped with TPU support wings and breathable quarter panel netting. Bright blue accents make their way to molded eyelets, a woven Jumpman tongue tag, and a back tab embellished with Nike Air branding. The lightweight polyurethane midsole features a blue topline and exposed Air-sole cushioning in the heel."
ff53cb60-0a1f-4366-b313-192ae1f01133,Jordan,Off White/Military Blue/Neutral Grey,100,youth,"{'360': [], 'original': '', 'small': '', 'thumbnail': ''}","{'stockX': '', 'goat': 'https://goat.com/sneakers/air-jordan-4-retro-ps-military-blue-2024-bq7669-141', 'flightClub': 'https://flightclub.com/air-jordan-4-retro-ps-military-blue-2024-bq7669-141', 'stadiumGoods': ''}",Air Jordan 4 Retro PS 'Military Blue' 2024,2024-04-27,2024,100,Air Jordan 4,BQ7669-141,"The 2024 edition of the Air Jordan 4 Retro PS ‘Military Blue’ brings back an OG colorway in a scaled-down build made for little kids. Constructed from off-white leather, the upper features signature AJ4 details, including quarter panel netting and TPU support wings. A vibrant blue Jumpman logo graces the woven tongue tag, matching the molded eyelets and a back tab marked with Nike Air branding. A two-tone foam midsole is supported underfoot by a herringbone-traction rubber outsole."
d3e4a9d1-6366-4557-96e1-52cf0d74ca03,Jordan,White/Coconut Milk/Vivid Sulfur/Anthracite,200,men,"{'360': [], 'original': '', 'small': '', 'thumbnail': ''}","{'stockX': 'https://stockx.com/air-jordan-4-retro-vivid-sulfur-womens', 'goat': 'https://goat.com/sneakers/wmns-air-jordan-4-retro-vivid-sulfur-aq9129-101', 'flightClub': 'https://flightclub.com/wmns-air-jordan-4-retro-vivid-sulfur-aq9129-101', 'stadiumGoods': ''}",Jordan 4 Retro Vivid Sulfur (Women's),2024-04-20,2024,200,Air Jordan 4,AQ9129-101,
d44700ae-a44e-41ac-85e9-ab19c9478a92,Jordan,Sail/University Red/Coconut Milk/Sandstone/Smoke Grey,160,men,"{'360': [], 'original': '', 'small': '', 'thumbnail': ''}","{'stockX': 'https://stockx.com/air-jordan-spizike-low-coconut-milk', 'goat': 'https://goat.com/sneakers/jordan-spizike-low-coconut-milk-fq1759-100', 'flightClub': 'https://flightclub.com/jordan-spizike-low-coconut-milk-fq1759-100', 'stadiumGoods': ''}",Jordan Spizike Low Coconut Milk,2024-04-15,2024,160,Jordan Spizike,FQ1759-100,
561b7d95-aad5-4ae0-b74b-6f216afcdf1c,Jordan,Sail/Black/Light Orewood Brown/Coconut Milk,210,men,"{'360': [], 'original': '', 'small': '', 'thumbnail': ''}","{'stockX': 'https://stockx.com/air-jordan-5-retro-se-sail', 'goat': 'https://goat.com/sneakers/air-jordan-5-retro-se-sail-fn7405-100', 'flightClub': 'https://flightclub.com/air-jordan-5-retro-se-sail-fn7405-100', 'stadiumGoods': ''}",Jordan 5 Retro SE Sail,2024-04-13,2024,210,Air Jordan 5,FN7405-100,
